{
  "schema_version": 1,
  "date": "2026-03-15",
  "timezone": "Asia/Tokyo",
  "status": "CLOSED",
  "closed_at": "2026-03-16T00:00:00+09:00",
  "actual_events": [
    {
      "schema_version": 1,
      "event_id": "actual-event:cb7c3346be03802cc974648dd6f028be",
      "activity_instance_id": "activity:5c1-fixture-1",
      "event_type": "LEISURE",
      "actual_start": "2026-03-15T10:00:00+09:00",
      "actual_end": "2026-03-15T11:00:00+09:00",
      "finalized_at": "2026-03-15T11:00:00+09:00",
      "location_id": "fixture-home",
      "summary": "public persistence fixture",
      "effects": [],
      "captures": [
        {
          "schema_version": 1,
          "capture_id": "capture:4ae04969c66566f51b163660b75730a4",
          "occurrence_key": "capture-occurrence:b0dec0fb98355181c038a503065b283c",
          "activity_instance_id": "activity:5c1-fixture-1",
          "captured_at": "2026-03-15T10:30:00+09:00",
          "capture_kind": "DAILY_LIFE",
          "subject_refs": [],
          "visual_context": {
            "character_id": "fixture-character",
            "character_source_sha": "public-persistence-character-sha",
            "engine_commit_sha": "aaaaaaaaaaaaaaaaaaaaaaaaaaaaaaaaaaaaaaaa",
            "behavior_policy_version": "public-fixture-v2-candidate-1",
            "location_id": "fixture-home",
            "appearance": {
              "outfit_state_id": null,
              "outfit_item_ids": [],
              "makeup_level": null,
              "hair_state_id": null
            },
            "home_revision": null,
            "wardrobe_revision": null,
            "photographer_ref": null,
            "companion_refs": [],
            "lighting_context": "NATURAL"
          },
          "capture_context_hash": "f58734b1be06788df53502fb81e5d9e83f7aefbd36af69a62676b72b14c8fb84",
          "capture_decision_evidence": {
            "schema_version": 1,
            "decision_type": "CAPTURE_OPPORTUNITY",
            "policy_version": "public-fixture-v2-candidate-1",
            "source_key": "source:decision:photo:5c1-1",
            "opportunity_key": "capture-opportunity:0b17b1ddc8771e679703f5c0b709f6c2",
            "activation_permille": 500,
            "rule_ids": [
              "test.synthetic.capture"
            ],
            "input_state_refs": [
              "state:test"
            ],
            "random_key": "aaaaaaaaaaaaaaaaaaaaaaaaaaaaaaaaaaaaaaaaaaaaaaaaaaaaaaaaaaaaaaaa",
            "selected_result": "TAKE_CAPTURE"
          }
        }
      ],
      "participants": [],
      "causes": [],
      "provenance": {
        "origin": "ACTUAL_EVENT"
      },
      "decision_evidence": null
    }
  ]
}
